{
  "name": "Thwartzki HUD",
  "author": "Thwartski",
  "contributors": ["Hypnotize"],
  "social": {
    "steam_group": "thwartskihud",
    "album": "https://github.com/TF2HUDsArchive/Thwartzki-Hud/blob/screenshots/showcase.md"
  },
  "repo": "https://github.com/TF2HUDsArchive/Thwartzki-Hud",
  "githubAuthor": null,
  "hash": "a4178ef940d470715df583f5f776deff470d65fa",
  "resources": ["thwartzki-hud-banner"]
}
