{
  "name": "KN-Edit",
  "author": "Chippy",
  "contributors": ["Hypnotize"],
  "social": {
    "steam_group": "knhud",
    "album": "https://github.com/TF2HUDsArchive/KN-Edit/blob/screenshots/showcase.md"
  },
  "repo": "https://github.com/TF2HUDsArchive/KN-Edit",
  "githubAuthor": null,
  "hash": "55d125662fd0fd86643b77c526f5b856b23f35c7",
  "parent": "kn-hud",
  "resources": ["kn-edit-banner"]
}
