{
  "name": "huehued",
  "author": "Unknown",
  "contributors": [
    "techno",
    "Hypnotize"
  ],
  "social": {
    "album": "https://imgur.com/a/lcxp5sm"
  },
  "repo": "https://github.com/tekunotri/huehued",
  "githubAuthor": null,
  "hash": "6776e558e7f48fd8a00fba4c5fc195da9790abbb",
  "parent": "quakehud",
  "resources": [
    "huehued-menu",
    "huehued-gameplay",
    "huehued-medic"
  ]
}
