{
  "name": "Prism HUD",
  "author": "JarateKing",
  "social": {
    "album": "https://github.com/TF2HUDsArchive/Prism-Hud/blob/screenshots/showcase.md"
  },
  "repo": "https://github.com/TF2HUDsArchive/Prism-Hud",
  "githubAuthor": "JarateKing",
  "hash": "2c4650a787812fd768bd33c0a813dca13fc033fe",
  "resources": ["prism-hud-banner"]
}
