{
  "name": "rhB HUD",
  "author": "rhK",
  "contributors": ["Hypnotize"],
  "social": {
    "album": "https://github.com/TF2HUDsArchive/rhB-Hud/blob/screenshots/showcase.md"
  },
  "repo": "https://github.com/TF2HUDsArchive/rhB-Hud",
  "githubAuthor": null,
  "hash": "df6af320a921c6900efce252f23931f44b9daa2e",
  "resources": ["rhb-hud-banner"]
}
