{
  "name": "ULTRAHUD",
  "author": "Heaven Piercer",
  "contributors": [
    "raysfire",
    "Hypnotize",
    "Village Green Preserver",
    "Tomma",
    "techno"
  ],
  "parent": "rayshud",
  "distinguishedFromParent": true,
  "releaseDate": "2024-02-24",
  "resources": [
    "ultrareboot_banner"
  ],
  "flags": [
    "fonts",
    "menus",
    "crosshairs",
    "minmode",
    "customization",
    "streamer-mode",
    "materials"
  ],
  "repo": "https://github.com/heaven-piercer/ULTRAHUD-TF2",
  "hash": "fb977a2dbf66a38cd26e7c5b64f9b96e4937e26b",
  "prerelease": false,
  "social": {
    "discord": "/v8nmUKRX62",
    "album": "https://imgur.com/a/Y7q58Im"
  },
  "traits": {
    "os": [
      "windows"
    ],
    "gamemode": [
      "ad",
      "ctf",
      "cp",
      "koth",
      "mvm",
      "pl"
    ],
    "res": [
      "16/9"
    ],
    "position": [
      "center",
      "corners"
    ],
    "lang": [
      "en"
    ]
  }
}
