{
  "name": "Middle-Mann",
  "author": "Vexcenot",
  "social": {
    "support": "https://ko-fi.com/vexcenot",
    "steam_profile": "76561198170023074",
    "discord": "/9QzHkQx",
    "youtube": "@Vexcenot",
    "album": "https://imgur.com/a/B1572CO"
  },
  "flags": [
    "fonts",
    "menus",
    "scoreboards",
    "crosshairs",
    "materials",
    "customization"
  ],
  "traits": {
    "os": [
      "windows",
      "mac",
      "linux"
    ],
    "gamemode": [
      "tournament",
      "comp",
      "arena",
      "ad",
      "ctf",
      "cp",
      "halloween",
      "koth",
      "mannpower",
      "mvm",
      "pass",
      "pl",
      "plr",
      "pd",
      "rd",
      "sd",
      "tc"
    ],
    "res": [
      "1/1",
      "4/3",
      "5/4",
      "16/10",
      "16/9",
      "17/9",
      "21/9",
      "32/9"
    ],
    "position": [
      "center",
      "corners",
      "default"
    ],
    "lang": [
      "en"
    ]
  },
  "tags": [
    "minimal",
    "modern",
    "middle",
    "vanilla"
  ],
  "repo": "https://github.com/Vexcenot/-Middle-Mann",
  "hash": "96dbeffab2fd2674c26c2794f9350cf3e151dba0",
  "resources": [
    "middlemann-banner"
  ]
}
