{
  "name": "Garm3n 7MF",
  "author": "Garm3n",
  "contributors": ["Hypnotize"],
  "social": {
    "album": "https://github.com/TF2HUDsArchive/Garm3n-7MF/blob/screenshots/showcase.md"
  },
  "repo": "https://github.com/TF2HUDsArchive/Garm3n-7MF",
  "githubAuthor": null,
  "hash": "458657fe37357491731abc4f1f3fa8fe081c563f",
  "parent": "quakehud",
  "resources": ["garm3n-7mf-banner"]
}
