{
  "name": "7HUD",
  "author": "sevin",
  "verified": true,
  "social": {
    "steam_profile": "76561198056804798",
    "steam_group": "7HUD",
    "album": "https://imgur.com/a/yluqH"
  },
  "flags": [
    "fonts",
    "menus",
    "scoreboards",
    "crosshairs",
    "materials",
    "customization"
  ],
  "traits": {
    "os": ["windows", "mac", "linux"],
    "gamemode": [
      "tournament",
      "comp",
      "arena",
      "ad",
      "ctf",
      "cp",
      "halloween",
      "koth",
      "mannpower",
      "mvm",
      "pass",
      "pl",
      "plr",
      "pd",
      "rd",
      "sd",
      "tc"
    ],
    "res": ["16/9"]
  },
  "repo": "https://github.com/Sevin7/7hud",
  "hash": "75daba995a8253d39926ec324e9f26709b27b8b6",
  "resources": ["7hud-banner"]
}
