{
  "name": "KX-Hud",
  "author": "Unknown",
  "contributors": ["Hypnotize"],
  "social": {
    "album": "https://github.com/TF2HUDsArchive/KX-Hud/blob/screenshots/showcase.md"
  },
  "repo": "https://github.com/TF2HUDsArchive/KX-Hud",
  "githubAuthor": null,
  "hash": "340480099fe83fba60dd62fbb740afc4ad37c03f",
  "resources": ["kx-hud-banner"]
}
