{
  "name": "Julia's HUD",
  "author": "face2face",
  "contributors": ["Hypnotize"],
  "social": {
    "album": "https://github.com/TF2HUDsArchive/Julias-Hud/blob/screenshots/showcase.md"
  },
  "repo": "https://github.com/TF2HUDsArchive/Julias-Hud",
  "githubAuthor": null,
  "hash": "f59817bd563772e196483341b70935b2626daab5",
  "resources": ["julias-hud-banner"]
}
