{
  "name": "JofreHUD",
  "author": "Jofre Problem?",
  "verified": true,
  "social": {
    "album": "https://imgur.com/a/8RKavUI"
  },
  "flags": ["fonts", "menus", "materials", "customization"],
  "traits": {
    "os": ["windows", "linux"],
    "gamemode": ["arena", "ad", "ctf", "cp", "koth", "pl"],
    "res": ["16/9", "16/10"]
  },
  "repo": "https://github.com/Jofre-Problem/JofreHUD",
  "hash": "ee162a5fbcde15edfb49800cd2a0ef1f8a496fbe",
  "resources": ["jofrehud-banner"]
}
