{
  "name": "ShrekHUD",
  "author": "Hypnotize",
  "social": {
    "steam_profile": "76561198058754493",
    "album": "https://github.com/Hypnootize/ShrekHUD/blob/screenshots/showcase.md"
  },
  "flags": ["fonts", "menus", "scoreboards", "crosshairs", "materials"],
  "traits": {
    "os": ["windows"],
    "gamemode": [
      "tournament",
      "comp",
      "arena",
      "ad",
      "ctf",
      "cp",
      "halloween",
      "koth",
      "mannpower",
      "mvm",
      "pass",
      "pl",
      "plr",
      "pd",
      "rd",
      "sd",
      "tc"
    ],
    "res": ["4/3", "5/4", "16/9", "16/10"]
  },
  "repo": "https://github.com/Hypnootize/ShrekHUD",
  "hash": "bec18281772cfa6797c8486f92baa3ca58d487a9",
  "resources": [
    "shrekhud-banner",
    "shrekhud-mm",
    "shrekhud-loadout",
    "shrekhud-backpack",
    "shrekhud-buff",
    "shrekhud-hurt",
    "shrekhud-uber",
    "shrekhud-scoreboard"
  ]
}
