{
  "name": "Garm3n FM-II",
  "author": "Garm3n",
  "contributors": [
    "techno"
  ],
  "social": {
    "album": "https://imgur.com/a/li4IloG"
  },
  "repo": "https://github.com/tekunotri/Garm3n-FM-II",
  "githubAuthor": null,
  "hash": "d52d5fcc2510a52350add6f6aaeb31a544c5d0ad",
  "parent": "quakehud",
  "resources": [
    "garm3n-fm-ii-banner"
  ]
}
