{
  "name": "g0R3HUD",
  "author": "g0Re",
  "contributors": ["Hypnotize"],
  "social": {
    "album": "https://github.com/TF2HUDsArchive/g0R3HUD/blob/screenshots/showcase.md"
  },
  "repo": "https://github.com/TF2HUDsArchive/g0R3HUD",
  "githubAuthor": null,
  "hash": "ab0697e9a55043d83b3471c51216ca0a78b774bb",
  "resources": ["g0r3hud-banner"]
}
